Contract,,,,,,,,,,,,,,,,,,,,,,,,
Master On-Call 2016: Transportation - AMEC Foster Wheeler,MA-F165-17000119,Closed,Design Professional Master Contract,CNV86614,MA,102 - Design,Chicago,F165,1000000,138410,0,861590,10/12/2016 00:00:00,,0,0,IL,,,Professional Service,NA,0,,
Master On-Call 2018: Electric UTILITY T&D Engineering Design - Vanderweil,MA-F165-19000175,Approved,Design Professional Master Contract,VS0000004891,MA,102 - Design,Boston,F165,1000000,152780,0,847220,01/08/2019 00:00:00,,0,0,MA,,,Professional Service,NA,0,,
CP0116CAP Falcon Field Recoating Tank - DO 14008781,DO-F165-14008781,Approved,Job Order,VC0000002111,DO,,Phoenix,F165,368168.96,0,0,368168.96,05/13/2014 00:00:00,06/10/2014 00:00:00,110,0,AZ,,Water Tower Renovations and Upgrades,Construction,Job Order Contracting (JOC),368168.96,,
"CP0634BR19 BRWTP Fiber Loop, PLC and MCC Replacements - Sturgeon CMAR",CT-F165-23000015,Approved,CMAR Construction Services Contract,CNV72346,CT,104 - Construction,Chicago,F165,3233697.24,0,0,3233697.24,08/02/2022 00:00:00,07/27/2022 00:00:00,250,251,IL,,"BRWTP City &amp; SCADA Fiber Loops, PLC &amp; MCCs, BRWTP City &amp; SCADA Fiber Loops, PLC &amp; MCCs - FUNDING ONLY",Construction,Construction Manager at Risk (CMAR),0,,
CP0552CAP Mesa Arts Center Grate Modifications,DO-F165-16002075,Closed,Job Order,VS0000000709,DO,104 - Construction,Tempe,F165,41999.8,0,0,41999.8,10/15/2015 00:00:00,09/02/2015 00:00:00,36,0,AZ,MA-F165-15000199,Mesa Arts Center Grate Modifications,Construction,Job Order Contracting (JOC),41999.8,,
CP0780BAL8 Balboa/8th Ave Bridge Repair Nesbitt Job Order,DO-F165-23001306,Approved,Job Order,CNV462756,DO,104 - Construction,Tempe,F165,27448.42,0,0,27448.42,09/13/2022 00:00:00,,30,31,AZ,MA-F165-22000303,"Balboa/8th Avenue Bridge Repair, Balboa/8th Avenue Bridge Repair - FUNDING ONLY",Construction,Job Order Contracting (JOC),0,,
CP0640PS3 PS-3 Discharge Piping & Meter Vault Improvements Garney Job Order,DO-F165-18007594,Approved,Job Order,CNV390275,DO,104 - Construction,Kansas City,F165,92697.7,0,0,92697.7,,04/11/2018 00:00:00,53,0,MO,MA-F165-18000007,"PS-3 Discharge Piping &amp; Meter Vault, PS-3 Discharge Piping &amp; Meter Vault Improvements-Funding only",Construction,Job Order Contracting (JOC),92697.7,,
CP0295CAP - Spring Training Multi-Use Facility,DO-F165-14007036,Approved,Project Order,CNV99546,DO,,Tucson,F165,123390,0,0,123390,,06/10/2014 00:00:00,,0,AZ,,Spring Training Multi-Use Facility,Professional Service,,131035,,
CP0628PLC NWWRP PLC Replacement Garney Job Order,DO-F165-20001337,Approved,Job Order,CNV390275,DO,104 - Construction,Kansas City,F165,229707.21,0,0,229707.21,11/04/2019 00:00:00,08/29/2019 00:00:00,54,97,MO,MA-F165-18000007R2,"NWWRP PLC Replacement, NWWRP PLC Replacement - Funding Only",Construction,Job Order Contracting (JOC),229707.21,,
"Master On-Call 2018: Electrical, Instrumentation, and Control Inspection and Testing Services - Arcadis",MA-F165-18000197,Approved,Design Professional Master Contract,CNV118419,MA,102 - Design,Chicago,F165,1000000,249820,0,750180,03/29/2018 00:00:00,03/29/2018 00:00:00,0,0,IL,,,Professional Service,NA,0,,
CP0485WSIS Woodglen Irrigation System Improvements Earthscapes Job Order,DO-F165-17003550,Approved,Job Order,VS0000008720,DO,104 - Construction,Phoenix,F165,453417.47,0,0,453417.47,,11/07/2016 00:00:00,178,0,AZ,MA-F165-16000388,Irrigation System Improvements at Woodglen Park,Construction,Job Order Contracting (JOC),448719.47,,
C03080RHAP Desert Well #18 Rehab / JOC,DO-F165-20000151,Approved,Job Order,CNV390275,DO,104 - Construction,Kansas City,F165,11781,0,0,11781,07/15/2019 00:00:00,07/11/2019 00:00:00,60,61,MO,MA-F165-19003238,"111, Desert Well 18 Equip Rehab",Construction,Job Order Contracting (JOC),11781,,
CP0013CAP City Center Design,CT-F165-15000067,Closed,Design Professional Services Contract,VS0000003545,CT,102 - Design,phoenix,F165,59262.4,0,0,59262.4,03/25/2014 00:00:00,,120,0,AZ,,City Center Design - OLD,Professional Service,,0,,
EMC2 Group Architects Professional Services Master Agreement,MA-F165-14000084,Approved,Design Professional Master Contract,MAR6000224405,MA,102 - Design,Mesa,F165,1000000,104224,20765,875011,08/21/2013 00:00:00,,,0,AZ,,,Professional Service,,1000000,,
CP0688 Gene Autry Clubhouse Improvements Dibble & Associates Consulting Engineers,CT-F165-21000051,Approved,Design Professional Services Contract,CNV241687,CT,102 - Design,Phoenix,F165,9691,0,0,9691,12/22/2020 00:00:00,12/22/2020 00:00:00,167,168,AZ,,"CP0688 Gene Autry Clubhouse Improvments - Master, Gene Autry Clubhouse Septic System Abandonment - FUNDING ONLY",Professional Service,NA,0,,
Master On-Call 2018 RENEWAL: Landscape Arch - EPG,MA-F165-18000251R1,Approved,Design Professional Master Contract,VC0000013328,MA,102 - Design,Phoenix,F165,1000000,0,0,1000000,05/23/2019 00:00:00,05/23/2019 00:00:00,0,0,AZ,,,Professional Service,NA,0,,
LF0090FAST Seal Coat Various Streets - Talis Construction Corporation,DO-F920-15008168,Approved,Job Order,CNV570044,DO,,Tempe,F920,140918.48,0,0,140918.48,03/16/2015 00:00:00,,60,0,AZ,MA-F165-13000770Y3,FAST 2014 - Various Street Locations,Construction,Job Order Contracting (JOC),0,,
Master On-Call 2016 RENEWAL: Electrical Engineering GENERAL Design - LSW,MA-F165-17000159R1,Approved,Design Professional Master Contract,CNV514330,MA,102 - Design,Phoenix,F165,1000000,0,0,1000000,11/09/2017 00:00:00,,0,0,AZ,,,Professional Service,NA,0,,
Master On-Call RENEWAL: Wastewater Facilities - Brown & Caldwell,MA-F165-15000132R1,Closed,Design Professional Master Contract,CNV117684,MA,102 - Design,San Francisco,F165,1000000,134006,0,865994,10/02/2015 00:00:00,,,0,CA,,,Professional Service,,1000000,,
Master On-Call: Water-Wastewater Infrastructure in ROW - Sunrise Engineering,MA-F165-15000144,Closed,Design Professional Master Contract,CNV23329,MA,102 - Design,Phoenix,F165,1000000,0,0,1000000,10/01/2014 00:00:00,,,0,AZ,,,Professional Service,,1000000,,
14000085,MA-F165-14000085,Approved,Design Professional Master Contract,CNV534900,MA,,Phoenix,F165,1000000,0,0,1000000,12/22/2012 00:00:00,06/10/2014 00:00:00,,0,AZ,,,Professional Service,,1000000,,
14000293,MA-F165-14000293,Approved,Design Professional Master Contract,VS0000001769,MA,,Phoenix,F165,1000000,0,0,1000000,08/13/2012 00:00:00,06/10/2014 00:00:00,,0,AZ,,,Professional Service,,1000000,,
CP1101 Ramada Household Hazardous Materials Facility Ritoch-Powell & Associates Project Order,DO-F165-22005174,Approved,Project Order,CNV159158,DO,102 - Design,Phoenix,F165,19240,0,0,19240,01/18/2022 00:00:00,01/18/2022 00:00:00,270,331,AZ,MA-F165-21000034R1,"Ramada for Household Hazardous Materials Facility, Ramada for Household Hazardous Materials Facility - FUNDING ONLY",Professional Service,NA,0,,
CP0031 City Well 8 Equipping Wilson Engineers Project Order,DO-F165-17003042,Approved,Project Order,CNV309540,DO,102 - Design,Phoenix,F165,154870,0,0,154870,,,587,0,AZ,MA-F165-17000102,"Equip City Well #8 - FUNDING ONLY, Equip City Well #8 Master",Professional Service,NA,121925,,
Master On-Call: Architectural Projects - Historic Streetscapes,MA-F165-15000242,Closed,Design Professional Master Contract,CNV64629,MA,102 - Design,Mesa,F165,1000000,20765,0,979235,12/01/2014 00:00:00,,,0,AZ,,,Professional Service,,1000000,,
CP0643SB02 SBWTP Switchgear Improvements - Garney Construction,DO-F165-21006298,Approved,Job Order,CNV390275,DO,104 - Construction,North Kansas City,F165,143046.09,0,0,143046.09,05/03/2021 00:00:00,03/15/2021 00:00:00,120,121,MO,MA-F165-21000037,"SBWTP Switchgear Improvements, SIGNAL BUTTE WTP MISC. PLANT IMP - FUNDING ONLY",Construction,Job Order Contracting (JOC),143046.09,,
CP0763FTR Fighter Aces Drive Master Plan Ritoch-Powell & Associates Project Order,DO-F165-22000557,Approved,Project Order,CNV159158,DO,102 - Design,Phoenix,F165,166372,0,0,166372,08/05/2021 00:00:00,08/05/2021 00:00:00,120,151,AZ,MA-F165-21000034R1,"Fighter Aces Drive Redevelopment Project ""SO""",Professional Service,NA,0,,
CP03830002 263 N. Dobson Rd. Sewer Service Repl. Talis,DO-F165-16006668,Approved,Job Order,CNV570044,DO,104 - Construction,Tempe,F165,32328.22,0,0,32328.22,02/23/2016 00:00:00,02/22/2016 00:00:00,30,0,AZ,MA-F165-13000770Y4,Sewer Line Rehabilitation SwrSrv263 Dobson,Construction,Job Order Contracting (JOC),38470.96,,
CP0948ST01 Structural Manhole Repair Phase 1 - PEC Design,DO-F165-22010436,Approved,Design Professional Services Contract,CNV578495,DO,102 - Design,Phoenix,F165,67083.04,0,0,67083.04,06/22/2022 00:00:00,06/22/2022 00:00:00,182,183,AZ,,"Structural Manhole Repairs Phase 1 - ""DO"", Structural Manhole Repairs Phase 1 - FUNDING ONLY",Professional Service,NA,67083.04,,
Master On-Call Electrical Engineering 2020 - GLHN,MA-F165-21000143,Approved,Design Professional Master Contract,VS0000003408,MA,,Tucson,F165,1000000,0,0,1000000,,11/24/2020 00:00:00,0,0,AZ,,,Professional Service,NA,0,,
GR05472201 Biology Amplification - Storage Room Remodel GH2 Architects Project Order,DO-F165-23002231,Approved,Project Order,VS0000011617,DO,102 - Design,Tulsa,F165,4290,0,0,4290,09/22/2022 00:00:00,09/22/2022 00:00:00,60,61,OK,MA-F165-21000159R1,"Biology Amp/Storage Room Remodel, Biology Amp/Storage Room Remodel - FUNDING ONLY",Professional Service,NA,0,,
CP0870 Food to Energy Phase 1: Flare to Fuel/CMAR Pre-Construction/Archer Western,CT-F165-21000061,Approved,CMAR Pre-Construction Services Contract,CNV41076,CT,102 - Design,Phoenix,,105721,0,0,105721,11/12/2021 00:00:00,01/26/2021 00:00:00,0,0,AZ,,"Food to Energy Phase 1 - Flare to Fuel, Waste To Energy Project-Funding only",Construction,Construction Manager at Risk (CMAR),0,,
CP0557STRM Horne Rd Storm Drain,DO-F165-16000144,Approved,Project Order,VS0000005577,DO,102 - Design,Phoenix,F165,244565,0,0,244565,,,,0,AZ,MA-F165-15000139,Horne Rd Storm Drain,Professional Service,,230389.66,,
2022125Ctest2,2022125C2,Estimate,CMAR Construction Services Contract,CENTRAL CREATIVE LLC,MA,,Phoenix,F920,0,0,0,0,,,0,0,AZ,,2022125Ptest1,Construction,Construction Manager at Risk (CMAR),0,,
CP00240007 Brown Rd Water Treatment Plant Filters 1-4 & 6 Underdrain Replacement PCL Construction,DO-F165-16008266,Closed,Job Order,VS0000000927,DO,104 - Construction,Tempe,F165,665796,0,0,665796,,04/19/2016 00:00:00,,0,AZ,MA-F165-14000499R2,"Brown Road Water Treatment Plant Rehabilitation Filters 1-4,6",Construction,Job Order Contracting (JOC),665796,02/18/2016 00:00:00,
14000200,MA-F165-14000200,Approved,Design Professional Master Contract,CNV514330,MA,,Phoenix,F165,1000000,0,0,1000000,07/09/2013 00:00:00,06/10/2014 00:00:00,,0,AZ,,,Professional Service,,1000000,,
CP0279CAP Right of Way Improvements/1st Ave,DO-F165-14008087,Approved,Job Order,CNV570044,DO,,Tempe,F165,213006.22,0,0,213006.22,04/08/2014 00:00:00,06/10/2014 00:00:00,90,0,AZ,MA-F920-13000770Y2,Lindsay/Southern Landscape Improvements,Construction,Job Order Contracting (JOC),209464.58,,
Master On-Call RENEW: Water & Wastewater Pipeline Design - PEC,MA-F165-19000083R1,Approved,Design Professional Master Contract,CNV578495,MA,102 - Design,Phoenix,F165,1000000,939764.82,0,60235.18,,09/12/2019 00:00:00,0,0,AZ,,,Professional Service,NA,0,,
CP1125 Electric Fire Apparatus Battery and Charging Study,DO-F165-23002044,Approved,Project Order,CNV63444,DO,102 - Design,Chandler,F165,12615,0,0,12615,09/26/2022 00:00:00,09/26/2022 00:00:00,60,61,AZ,MA-F165-21000186R1,"Electric Fire Apparatus Charging and Battery Study - FUNDING ONLY, Electric Fire Apparatus DC Charger",Professional Service,NA,0,,
14000029,MA-F165-14000029,Approved,Design Professional Master Contract,CNV498629,MA,,Tempe,F165,1000000,0,0,1000000,11/13/2012 00:00:00,06/10/2014 00:00:00,,0,AZ,,,Professional Service,,1000000,,
"JOC-EL20 Job Order Contract Master: Hawkeye Electric, Inc.",MA-F165-21000128,Approved,Job Order Master,CNV109843,MA,104 - Construction,Gilbert,F165,3000000,49707.85,0,2950292.15,09/21/2020 00:00:00,09/21/2020 00:00:00,365,366,AZ,,,Construction,Job Order Contracting (JOC),3000000,,
"CP0508CAP Reliability Improvements to DW PS1, DS PS1, and TS2",CT-F165-16000056,Approved,Design Professional Services Contract,CNV385395,CT,102 - Design,Cave Creek,F165,45617.5,0,0,45617.5,09/28/2015 00:00:00,09/28/2015 00:00:00,331,332,AZ,,"Reliability Improvements to DW PS1, DS PS1, and TS2",Professional Service,,0,,
JOC-L19 Job Order Master Agreement: Valley Rain RENEWAL2,MA-F165-20000015R2,Approved,Job Order Master,MAR222550210,MA,104 - Construction,Tempe,F165,5000000,429859.52,0,4570140.48,07/11/2021 00:00:00,07/11/2021 00:00:00,0,0,AZ,,,Construction,Job Order Contracting (JOC),0,,
CP0420 CAD to RADS Oz Engineering Design Services Contract,CT-F165-17000066,Approved,Design Professional Services Contract,VS0000009358,CT,102 - Design,Phoenix,F165,79199.6,0,0,79199.6,08/03/2016 00:00:00,08/03/2016 00:00:00,150,211,AZ,,ITS-Integrate Mesa 911 Call Grant,Professional Service,NA,0,,
CP0668 Main Street Tree Revitalization - Norris Design,CT-F165-21000077,Approved,Design Professional Services Contract,VS0000001581,CT,102 - Design,Phoenix,F165,41861,0,0,41861,03/17/2021 00:00:00,03/17/2021 00:00:00,75,76,AZ,,"Main Street Tree Revitalization - ""SO"", Main Street Tree Revitalization-Funding Only",Professional Service,NA,0,,
OT0115 GWRP Perimeter Wall Security Improvements - Genesis Landscaping,DO-F165-20008842,Approved,Job Order,VC0000025388,DO,104 - Construction,Mesa,F165,11450,0,0,11450,07/06/2020 00:00:00,06/18/2020 00:00:00,30,31,AZ,MA-F165-20000012,"GWRP Perimeter Wall Security Enhancement, GWRP Perimeter Wall Security Enhancement (Pre-Design) - FUNDING ONLY",Construction,Job Order Contracting (JOC),0,,
14000198,MA-F165-14000198,Approved,Design Professional Master Contract,CNV445118,MA,,City Of Industry,F165,1000000,0,0,1000000,10/01/2013 00:00:00,06/10/2014 00:00:00,,0,CA,,,Professional Service,,1000000,,
CP0491P147 Emerald Park Pump Station No.147 Rehabilitation Garney Job Order,DO-F165-21001287,Approved,Job Order,CNV390275,DO,104 - Construction,Kansas City,F165,1410953.11,0,0,1410953.11,10/05/2020 00:00:00,09/08/2020 00:00:00,180,230,MO,MA-F165-19003238R1,Emerald Park Pump Station No.147 Rebuild,Construction,Job Order Contracting (JOC),1392250.22,,
Master On-Call 2018: Transportation - Jacobs,MA-F165-19000107,Approved,Design Professional Master Contract,CNV42064,MA,102 - Design,Phoenix,F165,1000000,0,0,1000000,10/04/2018 00:00:00,,0,0,AZ,,,Professional Service,NA,0,,
CP0632 SEWRP Standby Generator Radiator M3 Engineering Project Order,DO-F165-19003705,Approved,Project Order,VS0000005431,DO,102 - Design,Tucson,F165,15827,0,0,15827,11/06/2018 00:00:00,11/06/2018 00:00:00,60,61,AZ,MA-F165-17000165R1,"SEWRP Standby Generator Radiator Replacement, SEWRP Standby Generator Radiator Replacement-Funding only",Professional Service,NA,0,,
CP06240003 Lyn Rae Square Sewer,DO-F165-17004044,Closed,Job Order,CNV668524,DO,104 - Construction,Phoenix,F165,362918.09,0,0,362918.09,,12/28/2016 00:00:00,90,0,AZ,MA-F165-16000376,"Extension to Unsewered Areas -  Lyn Rae Square, Extension to Unsewered Areas -  Lyn Rae Square- Funding Only",Construction,Job Order Contracting (JOC),362918.09,,
CP0627-0001 NWWRP Headworks Process Eval Arcadis US,DO-F165-20004765,Approved,Project Order,CNV118419,DO,102 - Design,Chicago,F165,46780,0,0,46780,12/16/2019 00:00:00,12/16/2019 00:00:00,90,91,IL,MA-F165-18000197R1,"NWWRP Facility Evaluation-funding only, NWWRP Facility Evaluation-SO",Professional Service,NA,0,,
CP0921 Falcon Field Higley East Ramp Reconstruction - Combs Construction,CT-F165-21000020,Approved,Construction Services Contract for Design-Bid-Build Projects,CNV52957,CT,104 - Construction,Glendale,F165,474495.04,0,0,474495.04,10/26/2020 00:00:00,09/14/2020 00:00:00,60,65,AZ,,"FALCON FIELD (FFZ) HIGLEY RAMP EAST RECONSTRUCT, FALCON FIELD AIRPORT (FFZ) RECONSTRUCT HIGLEY RAMP EAST - FUNDING ONLY",Construction,Design Bid Build (DBB),0,,
"CP0587CAP Amphitheater Catwalk, Rigging and Lighting Imp SDB Job Order",DO-F165-16009269,Approved,Job Order,CNV673366,DO,104 - Construction,Tempe,F165,364773.21,0,0,364773.21,05/16/2016 00:00:00,05/16/2016 00:00:00,46,0,AZ,MA-F165-16000371,Mesa Amphitheater Catwalk and Rigging Improvements,Construction,Job Order Contracting (JOC),364773.21,,
63rd Street & Broadway Road Drainage Improvements,CT-F165-17000087,Approved,Design Professional Services Contract,VS0000001561,CT,102 - Design,Phoenix,F165,68220,0,0,68220,11/22/2016 00:00:00,,113,439,AZ,,63rd and Broadway Drainage - STORM FUNDING ONLY,Professional Service,NA,0,,
CP0224CAP Cooper Road Gas Main Replacement Arizona Farms Road to Magma Road - Arizona Pipeline Company/DBB,CT-F165-20000083,Closed,Construction Services Contract for Design-Bid-Build Projects,CNV85146,CT,104 - Construction,Hesperia,F165,306463.05,0,0,306463.05,04/27/2020 00:00:00,03/18/2020 00:00:00,90,91,CA,,"Cooper Rd Main Replacement 4"" PE, Cooper Rd Main Replacement 4"" PE Funding Only",Construction,Design Bid Build (DBB),0,,
CP04610013 - 69kV Breaker Replacement at Lewis Substation TOR Project Order,DO-F165-16009584,Approved,Project Order,CNV483087,DO,102 - Design,Phoenix,F165,77283.25,0,0,77283.25,,06/02/2016 00:00:00,0,0,AZ,MA-F165-15000210R1,"Replace 69kV Breakers for Lewis Substation, Replace 69kV Breakers for Lewis Substation Funding Only",Professional Service,NA,77283.25,,
CP0942 Marlborough Park Playground Improvements Hesscor Job Order,DO-F165-21003115,Approved,Job Order,CNV37052,DO,104 - Construction,Mesa,F165,115368.06,0,0,115368.06,12/04/2020 00:00:00,11/16/2020 00:00:00,110,111,AZ,MA-F165-21000039,"Marlborough Mesa Park Playground Improvements, Marlborough Mesa Park Playground Improvements - FUNDING ONLY",Construction,Job Order Contracting (JOC),115368.06,,
CP0871 ASU at Mesa City Center - Arcadis Cost Estimating Contract,CT-F165-20000082,Approved,Design Professional Services Contract,CNV118419,CT,102 - Design,Chicago,F165,75200,0,0,75200,03/17/2020 00:00:00,03/17/2020 00:00:00,1000,1001,IL,,"ASU @ Mesa City Center, City Center ASU-Funding only",Professional Service,NA,0,,
On-Call Inspections Brown & Associates,DO-F165-TIMESHEETBROWN,Closed,Design Professional Services Contract,VC0000013827,DO,,Phoenix,F165,250000,0,0,250000,,,0,0,AZ,,On-Call Inspections Brown &amp; Associates,Professional Service,NA,0,,
Master On-Call 2016: Water & Wastewater Pipelines,MA-F165-17000094,Closed,Design Professional Master Contract,CNV336912,MA,102 - Design,Columbus,F165,1000000,0,0,1000000,,,0,0,OH,,,Professional Service,NA,0,,
CP0953SE14 SEWRP Sludge Transfer Pumps VFD Replacements Jensen Engineering/Project Order,DO-F165-21003820,Approved,Project Order,CNV385395,DO,102 - Design,Cave Creek,F165,12375,0,0,12375,12/07/2020 00:00:00,12/07/2020 00:00:00,126,127,AZ,MA-F165-19000132R1,"SEWRP Sludge Transfer VFD Replacement, SEWRP Sludge Transfer VFD Replacement - FUNDING ONLY",Professional Service,NA,0,,
LF0079MBEI  Municipal Bldg Elevator Impovements,DO-F165-15006589,Closed,Project Order,VS0000005431,DO,102 - Design,Tucson,F165,51920.33,0,0,51920.33,,,,0,AZ,MA-F165-15000161,Municipal Bldg Elevator Impovements,Professional Service,,51920.33,,
Master On-Call 2016 RENEWAL: Water & Wastewater Pipelines - PEC,MA-F165-17000096R1,Closed,Design Professional Master Contract,CNV578495,MA,102 - Design,Phoenix,F165,1000000,244307.75,0,755692.25,09/29/2017 00:00:00,,0,0,AZ,,,Professional Service,NA,0,,
CP0570CAP PD Impound Lot Improvements,DO-F165-16002258,Approved,Job Order,CNV570044,DO,104 - Construction,Tempe,F165,115152.69,0,0,115152.69,,11/03/2015 00:00:00,,0,AZ,MA-F165-13000770Y3,PD Impound Lot Improvements,Construction,Job Order Contracting (JOC),115152.69,09/24/2015 00:00:00,
Greenfield Park Impr CP0010 Hunter,CT-F165-17000099,Closed,CMAR Construction Services Contract,CNV318752,CT,104 - Construction,Gilbert,F920,690717.19,0,0,690717.19,11/09/2016 00:00:00,11/08/2016 00:00:00,129,213,AZ,,"Greenfield Park Urban Fishing Lake, Greenfield Park Urban Fishing Lake ECF Funding Only, Greenfield Park Urban Fishing Lake Funding Only, Greenfield Park Urban Fishing Lake-Streets Funding Only, Greenfield Prk Impv Impact Fees",Construction,Construction Manager at Risk (CMAR),0,,
C05007 Warner Road Lift Station Garney CMAR Contract,CT-F165-20000069,Approved,CMAR Pre-Construction Services Contract,CNV390275,CT,104 - Construction,Kansas City,F165,61124.5,0,0,61124.5,11/13/2019 00:00:00,11/13/2019 00:00:00,180,181,MO,,"Warner Road Lift Station - Gas Funding, Warner Road Lift Station - Wastewater Funding, Warner Road Lift Station (Onsite and Offsite)",Construction,Construction Manager at Risk (CMAR),0,,
C01645 GMP 2 Central Arizona Project (CAP) Raw Water Pipeline Garney,CT-F165-18000054,Closed,CMAR Construction Services Contract,CNV390275,CT,104 - Construction,Kansas City,F165,3147345.89,0,0,3147345.89,01/11/2018 00:00:00,01/08/2018 00:00:00,248,249,MO,,"CAP Raw Water Pipeline and Elliot Road Improvements, CAP Raw Water Pipeline Street Overlay Portion-funding only, CAP Raw Waterline roadway portion of water work-funding only, Street project from CAP to Signal Butte Wtr Treatment Plant, Waterline from CAP to Signal Butte Water Treatment Plant",Construction,Construction Manager at Risk (CMAR),0,,
Mesa Art Center Gas Equipment Improvements LF0052ACLP IMEG Corp,CT-F165-17000135,Approved,Design Professional Services Contract,VS0000010148,CT,102 - Design,Rock Island,F165,7180,0,0,7180,04/17/2017 00:00:00,04/17/2017 00:00:00,42,43,IL,,Arts &amp; Culture Lifecycle Plan,Professional Service,NA,0,,
CP1019 PSTF Burn Building Expansion CORE Construction - Preconstruction Services Contract,CT-F165-18000066,Approved,CMAR Pre-Construction Services Contract,VS0000002305,CT,104 - Construction,Phoenix,F165,13140,0,0,13140,02/15/2018 00:00:00,02/15/2018 00:00:00,222,223,AZ,,"2020 Public Safety Training Facility Burn Building, 2020 Public Safety Training Facility Burn Building - FUNDING ONLY",Construction,Construction Manager at Risk (CMAR),0,,
CP0871/CP0880/CP0920 Construction Inspection Contract for downtown projects - Brown and Associates,CT-F165-21000069,Approved,Design Professional Services Contract,VC0000013827,CT,104 - Construction,Phoenix,F165,152000,0,0,152000,02/08/2021 00:00:00,02/08/2021 00:00:00,270,271,AZ,,"ASU @ Mesa City Center, City Center ASU-Funding only, The Plaza at Mesa City Center, The Plaza at Mesa City Center - Funding Only, The Studios at Mesa City Center, The Studios at Mesa City Center - Funding Only",Professional Service,NA,0,,
QS133B Water Main and Sanitary Sewer Improvements Main and Crismon,DO-F165-16006799,Approved,Project Order,VS0000003462,DO,102 - Design,Pittsburgh,F920,453680,0,0,453680,,03/07/2016 00:00:00,0,0,PA,MA-F165-15000128R1,"Arbor and Power Master - Water and Sewer Improvements (QS 93D), Sewer Line Extensions to Unsewered Arbor and Power, Water System Aging Main Rehab and Repair - Main and Crismon, Water System Aging Main Rehab and Repair, Arbor and Power - FUNDING ONLY",Professional Service,,453680,,
C01886PH3 SCADA System Improvements-Phase III,CT-F165-16000044,Approved,Design Professional Services Contract,CNV385395,CT,102 - Design,Cave Creek,F165,46745,0,0,46745,09/08/2015 00:00:00,,158,203,AZ,,SCADA System Improvements-Phase III Citywide,Professional Service,,0,,
CP0986 Smart City Kiosks Hawkeye Electric Job Order,DO-F165-21006085,Approved,Job Order,CNV109843,DO,104 - Construction,Gilbert,F165,37707.85,0,0,37707.85,03/22/2021 00:00:00,03/15/2021 00:00:00,30,31,AZ,MA-F165-21000128,"Smart City Downtown Kiosk Pilot, Smart City Downtown Kiosk Pilot - FUNDING ONLY",Construction,Job Order Contracting (JOC),0,,
Test Contract K02,K02,Estimate,Design Professional Services Contract,ALL STAR SPORTS LLC,MA,,Acworth,F165,0,0,0,0,,,0,0,GA,,0531 Test 111,Professional Service,NA,0,,
JOC-W20 Job Order Contract Master: Garney,MA-F165-21000037,Approved,Job Order Master,CNV390275,MA,104 - Construction,Kansas City,F165,5000000,458984.65,0,4541015.35,07/29/2020 00:00:00,07/29/2020 00:00:00,365,366,MO,,,Construction,Job Order Contracting (JOC),0,,
Master On-Call 2018 RENEWAL: Electrical Engineering GENERAL Design - ESD,MA-F165-19000131R1,Approved,Design Professional Master Contract,VS0000001771,MA,102 - Design,Scottsdale,F165,1000000,0,0,1000000,12/03/2019 00:00:00,,365,366,AZ,,,Professional Service,NA,0,,
M99-2017-011 Williams Field Alignment Study Aztec Engineering,DO-F165-17003136,Approved,Project Order,VS0000001831,DO,102 - Design,Phoenix,F165,15072,0,0,15072,10/18/2016 00:00:00,10/18/2016 00:00:00,0,0,AZ,MA-F165-15000190R1,"Williams Field Road Alignment Study ""SO""",Professional Service,NA,0,,
CP1116CAP AzMNH SW Gallery Demolition Integrity Building Corp Job Order,DO-F165-23000861,Approved,Job Order,CNV133205,DO,104 - Construction,Mesa,F165,62562.11,0,0,62562.11,08/31/2022 00:00:00,08/10/2022 00:00:00,120,121,AZ,MA-F165-21000135R1,"AzMNH SW Gallery Demo and Floor Raising, AzMNH SW Gallery Demo and Floor Raising - FUNDING ONLY",Construction,Job Order Contracting (JOC),0,,
CP0797ODOR GWRP Misc Imp 2018 - Water Works Project Order,DO-F165-18003361,Approved,Project Order,CNV67806,DO,102 - Design,Scottsdale,F165,25620,0,0,25620,,11/01/2017 00:00:00,120,0,AZ,MA-F165-17000101R1,"GWRP Odor Control Trough Replacement, Primary Odor Control Scrubber Drainage Trough Rehab-Funding Only",Professional Service,NA,22320,,
LF0064RMTN Red Mountain Multi-Generational Center Structural Evaluation,CT-F165-16000054,Approved,Design Professional Services Contract,VS0000005967,CT,120 - Direct Expenses,San Diego,F165,9300,0,0,9300,03/30/2015 00:00:00,,60,61,CA,,Red Mountain Multi-Generational Center Structural Evaluation,Professional Service,,0,,
CP0426 Railroad Quiet Zones - Broadway and Extension - JOC Talis,DO-F165-17010264,Closed,Job Order,CNV570044,DO,104 - Construction,Tempe,F165,184144.1,0,0,184144.1,,07/11/2017 00:00:00,60,0,AZ,MA-F165-16000375R1,"Quiet Zone, UP Railroad, Dobson to Southern - FUNDING ONLY, Quiet Zone, UP Railroad, Dobson to Southern Master",Construction,Job Order Contracting (JOC),197649.01,,
