Contract,,,,,,,,,,,,,,,,,,,,,,,,
CP0952NW14 NWWRP Alternate Centrate Bypass - Garney Construction,DO-F165-22007732,Approved,Job Order,CNV390275,DO,104 - Construction,North Kansas City,F165,953085.27,0,0,953085.27,05/03/2022 00:00:00,03/30/2022 00:00:00,240,241,MO,MA-F165-21000037R1,"NWWRP Alternate Centrate Bypass, NWWRP Alternate Centrate Bypass - FUNDING ONLY",Construction,Job Order Contracting (JOC),953085.27,,
On-Call Master W/WW Plant Services - Hazen & Sawyer,MA-F165-21000092R2,Approved,Design Professional Master Contract,VS0000004871,MA,102 - Design,Hicksville,F165,1000000,0,0,1000000,10/15/2022 00:00:00,10/15/2022 00:00:00,365,366,NY,,,Professional Service,NA,0,,
LF0058SESF Electrical Service Entrance Replacement at Fleet West Caliente Construction,DO-F165-17001770,Approved,Job Order,VS0000000709,DO,104 - Construction,Tempe,F165,209266.72,0,0,209266.72,10/21/2016 00:00:00,10/17/2016 00:00:00,120,121,AZ,MA-F165-15000199R1,SES Dist Replacement for Fleet Support West,Construction,Job Order Contracting (JOC),0,,
CP0814PH02 Broadway Road Inspection Risers - Talis Job Order,DO-F165-20008146,Approved,Job Order,CNV570044,DO,104 - Construction,Mesa,F165,100898.04,0,0,100898.04,04/30/2020 00:00:00,04/27/2020 00:00:00,60,61,AZ,MA-F165-19003239,"Broadway Road Pipe Inspection Risers, Pipe Inspection Risers Phase 2-FUNDING ONLY",Construction,Job Order Contracting (JOC),106463.17,,
T2 Utility Engineers - On-Call Potholing Master Agreement - 1st Year Option,MA-F165-21000137R1,Approved,Design Professional Master Contract,VS0000013040,MA,102 - Design,Phoenix,F165,1000000,23774,0,976226,11/10/2021 00:00:00,11/10/2021 00:00:00,365,366,AZ,,,Professional Service,NA,0,,
Master On-Call 2016: Electrical Engineering GENERAL Design - LSW,MA-F165-17000159,Closed,Design Professional Master Contract,CNV514330,MA,102 - Design,Phoenix,F165,1000000,0,0,1000000,,,0,0,AZ,,,Professional Service,NA,0,,
LF0281MCLA Reconstruction of EB lanes of McLellan Road from Ellsworth to 86th Street / JOC,DO-F165-19008513,Approved,Job Order,CNV570044,DO,104 - Construction,Mesa,F165,402486,0,0,402486,04/22/2019 00:00:00,04/10/2019 00:00:00,180,336,AZ,MA-F165-16000375R2,"McLellan Rd-Ellsworth to 86th St - FUNDING ONLY, McLellan Rd-Ellsworth to 86th St (QS 115C)",Construction,Job Order Contracting (JOC),402486,,
CP0105 Val Vista Baseline to US 60,DO-F165-17000523,Approved,Project Order,VS0000001831,DO,102 - Design,Phoenix,F920,138324.88,0,0,138324.88,,07/20/2016 00:00:00,239,0,AZ,MA-F165-15000190R1,"Val Vista Baseline to Superstition Arterial Roadway Improvement, Val Vista-Baseline to Superstition Fwy-Arterial Rdwy Imp FUNDING ONLY, Val Vista-Baseline to US60 - GAS FUNDING ONLY",Professional Service,NA,138319.35,,
Master On-Call 2018 RENEWAL: Landscape Arch - J2 Eng,MA-F165-18000252R1,Approved,Design Professional Master Contract,CNV706930,MA,102 - Design,Phoenix,F165,1000000,0,0,1000000,05/23/2019 00:00:00,05/23/2019 00:00:00,0,0,AZ,,,Professional Service,NA,0,,
Master On-Call General Engineering - Kimley-Horn & Associates,MA-F165-21000032R1,Approved,Design Professional Master Contract,CNV445118,MA,102 - Design,Denver,F165,1000000,94224,0,905776,08/21/2021 00:00:00,08/21/2021 00:00:00,365,366,CO,,,Professional Service,NA,0,,
Master On-Call 2016 RENEWAL: Water & Wastewater Plants - Water Works,MA-F165-17000101R1,Closed,Design Professional Master Contract,CNV67806,MA,102 - Design,Scottsdale,F165,1000000,25620,0,974380,10/03/2017 00:00:00,,0,0,AZ,,,Professional Service,NA,0,,
CP0453CAP Electrical System Redundancy for ITD Bldg,CT-F165-15000033,Closed,Design Professional Services Contract,CNV385395,CT,102 - Design,Cave Creek,F165,58475,0,0,58475,09/20/2014 00:00:00,,300,301,AZ,,Electrical System Redundancy for ITD Bldg,Professional Service,,0,,
CP0383-0001 Wastewater Collection System Repairs B&F Contracting,DO-F165-17002196,Approved,Job Order,CNV668524,DO,104 - Construction,Phoenix,F165,270730.64,0,0,270730.64,,,90,0,AZ,MA-F165-16000376,"Sewer Line Rehabilitation, Sewer Line Rehabilitation 13SWR LNE REHBs",Construction,Job Order Contracting (JOC),270730.64,,
C07011-0007 Brown Road Water Treatment Plant Raw Water Flow Meter Replacement,DO-F165-18000428,Approved,Job Order,VS0000000927,DO,104 - Construction,Tempe,F165,88833.98,0,0,88833.98,,07/24/2017 00:00:00,238,0,AZ,MA-F165-18000006,Brown Road WTP Rehab Flowmeter Replacement,Construction,Job Order Contracting (JOC),88833.98,,
Master On-Call RENEWAL: General Engineering - AECOM,MA-F165-15000169R1,Closed,Design Professional Master Contract,CNV136565,MA,102 - Design,Chicago,F165,1000000,29266.03,36153.07,934580.9,10/02/2015 00:00:00,,,0,IL,,,Professional Service,,1000000,,
LF0033ASH Asphalt Patching Various Locations Phase 3 Talis Job Order,DO-F165-18006806,Approved,Job Order,CNV570044,DO,104 - Construction,Mesa,F165,483983.95,0,0,483983.95,,03/05/2018 00:00:00,60,0,AZ,MA-F165-16000375R1,Asphalt Patching Program,Construction,Job Order Contracting (JOC),465590,,
Master On-Call 2018: Construction Administration & Inspection Services - Brown & Associates,MA-F165-19000202,Closed,Design Professional Master Contract,VC0000013827,MA,102 - Design,Phoenix,F165,250000,0,0,250000,01/16/2019 00:00:00,01/16/2019 00:00:00,0,0,AZ,,On-Call Inspections Brown &amp; Associates,Professional Service,NA,0,,
C10597-3 GMP 2 Val Vista Transmission Main Ph3 Garney,CT-F165-17000065,Closed,CMAR Construction Services Contract,CNV390275,CT,104 - Construction,Kansas City,F165,2105673.71,0,0,2105673.71,09/07/2016 00:00:00,09/01/2016 00:00:00,233,297,MO,,Val Vista Transmission Mains Phase III,Construction,Construction Manager at Risk (CMAR),0,,
"CP04420004 8-Inch High Pressure Gas Line, Warner Rd - Power Rd to RWCD Canal Hunter Contracting Co",DO-F165-22001459,Approved,Job Order,CNV318752,DO,104 - Construction,Gilbert,F165,529356.95,0,0,529356.95,10/01/2021 00:00:00,08/30/2021 00:00:00,60,63,AZ,MA-F165-19003235R2,"8"" High Pressure Gas Line Extention: Warner - Power to RWCD Canal FUNDING ONLY, 8"" High Pressure Gas Line Extention: Warner - Power to RWCD Canal Master",Construction,Job Order Contracting (JOC),529356.95,,
C10414 Center Street Sewer and Water Replacements B&F Contracting,DO-F165-17000998,Closed,Job Order,CNV668524,DO,104 - Construction,Phoenix,F165,460371.29,0,0,460371.29,,08/09/2016 00:00:00,90,0,AZ,MA-F165-16000376,"Gas Line Replacement: Center St - University to 9th St, Sewer Line Replacement: Center St - University to 9th St, Water Line Replacement: Center St - University to 9th St",Construction,Job Order Contracting (JOC),460371.29,,
C10392CAP Transfer Station No. 3 Upgrade  Cooper Aerial Surveys Co.,CT-F165-16000032,Approved,Consultant Standard Terms Contract,CNV574155,CT,102 - Design,Phoenix,F165,4475,0,0,4475,08/04/2015 00:00:00,,10,0,AZ,,Transfer Station 3 Improvements,Professional Service,,0,,
LF0118 Ravine & 96th St Speed Cushions - Talis,DO-F165-15006699,Approved,Job Order,CNV570044,DO,,Tempe,F165,24871.64,0,0,24871.64,02/02/2015 00:00:00,,30,0,AZ,MA-F165-13000770Y3,Ravine and 96th Street Speed Cushion,Construction,Job Order Contracting (JOC),24871.64,,
JOC-U19 Job Order Master Agreement HUNTER Specialty Utility RENEWAL2,MA-F165-19003236R2,Approved,Job Order Master,CNV318752,MA,104 - Construction,Gilbert,F165,3000000,0,0,3000000,06/24/2021 00:00:00,06/24/2021 00:00:00,0,0,AZ,,,Construction,Job Order Contracting (JOC),0,,
JOC-T15 Renewal2 Job Order Contracting Transportation Services - Talis Construction,MA-F165-16000375R2,Approved,Job Order Master,CNV570044,MA,104 - Construction,Mesa,F165,10000000,6772442.03,364052.58,2863505.39,04/28/2018 00:00:00,,366,367,AZ,,,Construction,Job Order Contracting (JOC),0,,
14000202,MA-F165-14000202,Approved,Design Professional Master Contract,CNV410470,MA,,Phoenix,F165,1000000,0,0,1000000,12/11/2013 00:00:00,06/10/2014 00:00:00,,0,AZ,,,Professional Service,,1000000,,
CP0871 ASU at Mesa City Center/ The Plaza at Mesa City Center - DPR Construction - Preconstruction Contract,CT-F165-19000103,Approved,CMAR Pre-Construction Services Contract,VS0000012612,CT,102 - Design,Phoenix,F165,753731,0,0,753731,02/07/2019 00:00:00,02/09/2019 00:00:00,455,456,AZ,,"ASU @ Mesa City Center, City Center ASU-Funding only, The Plaza at Mesa City Center, The Plaza at Mesa City Center - Funding Only",Construction,Construction Manager at Risk (CMAR),0,,
Master On-Call 2016 RENEWAL: Architectural Services - Architekton,MA-F165-17000198R1,Approved,Design Professional Master Contract,CNV498629,MA,102 - Design,Tempe,F165,1000000,37250,0,962750,12/27/2017 00:00:00,,0,0,AZ,,,Professional Service,NA,0,,
C070110005 Brown Rd WTP Rapid Mixer 5 & 6 Repair PCL Construction Inc,DO-F165-16002076,Approved,Job Order,VS0000000927,DO,104 - Construction,Tempe,F165,120090,0,0,120090,09/28/2015 00:00:00,,159,0,AZ,MA-F165-14000499R1,Brown Road Water Treatment Plant Misc. Improvements - Rapid Mixer,Construction,Job Order Contracting (JOC),120090,07/02/2015 00:00:00,
LF0033PAS Pasadena & Sycamore Asphalt Repairs,DO-F165-16009044,Approved,Job Order,CNV570044,DO,120 - Direct Expenses,Tempe,F920,170274.39,0,0,170274.39,05/18/2016 00:00:00,05/10/2016 00:00:00,45,0,AZ,MA-F165-13000770Y4,Pasadena &amp; Sycamore,Construction,Job Order Contracting (JOC),170274.39,,
CP0747 MFAC Sound Attenuation Upgrades SDB Contracting Services Job Order,DO-F165-18009937,Approved,Job Order,CNV673366,DO,104 - Construction,Tempe,F165,63859.76,0,0,63859.76,,07/02/2018 00:00:00,83,0,AZ,MA-F165-16000371R2,"Advocacy Center Interview Suite Sound Attenuation Upgrades - FUNDING ONLY, Advocacy Center Interview Suite Sound Attenuation Upgrades Master",Construction,Job Order Contracting (JOC),59758.79,,
Master On-Call: Falcon Field Airport Consulting Services - Stantec,MA-F165-16000265,Closed,Design Professional Master Contract,VS0000000998,MA,102 - Design,Chicago,F165,1000000,0,0,1000000,02/10/2016 00:00:00,,,0,IL,,,Professional Service,,1000000,,
C01400CAP Mesa Drive Phase II,CT-F165-15000021,Approved,Design Professional Services Contract,CNV241687,CT,102 - Design,Phoenix,F165,1958200.5,0,0,1958200.5,08/26/2014 00:00:00,,504,1649,AZ,,"Mesa Drive Phase II - Electric - FUNDING ONLY, Mesa Drive Phase II - Gas - FUNDING ONLY, Mesa Drive Phase II - Master1, Mesa Drive Phase II - Transportation - FUNDING ONLY, Mesa Drive Phase II - Water - FUNDING ONLY",Professional Service,,0,,
CP0678 Main Library Renovation Thinkspot II Project Order Architekton,DO-F165-17000787,Closed,Project Order,CNV498629,DO,102 - Design,Tempe,F165,59754,0,0,59754,,08/02/2016 00:00:00,0,0,AZ,MA-F165-15000240R1,"CDBG PY 2015 MAIN LIBRARY, Main Library Renovations - ThinkSpot II, SRPMIC MAIN LIBRARY",Professional Service,NA,54997.72,,
"CP0696 Fiber Network Expansion Phase 2 - Engineering and Environmental Consultants, Inc.",CT-F165-20000074,Approved,Design Professional Services Contract,CNV99546,CT,102 - Design,Tucson,F165,585310,0,0,585310,,12/23/2019 00:00:00,0,0,AZ,,Fiber Network Expansion - Phase 2,Professional Service,NA,0,,
CP0916 idea Museum - Cost Estimating Contract - Abacus,CT-F165-22000097,Approved,Design Professional Services Contract,VS0000004792,CT,102 - Design,Phoenix,F165,17261,0,0,17261,03/22/2022 00:00:00,03/22/2022 00:00:00,45,46,AZ,,"IDEA Phase 1 - Funding Only, IDEA Rennovation",Professional Service,NA,0,,
63rd St. and Broadway Rd. Drainage Improvements CP0613 Talis Construction Corp,DO-F165-17009233,Approved,Job Order,CNV570044,DO,104 - Construction,Tempe,F165,545364.21,0,0,545364.21,,05/25/2017 00:00:00,60,0,AZ,MA-F165-16000377R1,"63rd and Broadway Drainage, 63rd and Broadway Drainage - GRANT FUNDING ONLY, 63rd and Broadway Drainage - STORM FUNDING ONLY",Construction,Job Order Contracting (JOC),526675.48,04/13/2017 00:00:00,
202355Ctest5,202355C5,Approved,CMAR Construction Services Contract,ALL STAR SPORTS LLC,MA,,Acworth,F165,12000,0,0,12000,,,0,0,GA,,2022125Ptest3,Construction,Construction Manager at Risk (CMAR),0,,
LF0257 Network Core Relocation Conduit System Improvements B&F Contracting Job Order,DO-F165-18009510,Approved,Job Order,CNV668524,DO,,Phoenix,F165,161633.24,0,0,161633.24,,06/04/2018 00:00:00,60,0,AZ,MA-F165-16000376R2,"ITB Network Core Relocation - FUNDING ONLY, Network Core Relocation - Master",Construction,Job Order Contracting (JOC),134356.89,,
JOC-T15 Job Order Master Agreement Talis,MA-F165-16000375,Approved,Job Order Master,CNV570044,MA,,Tempe,F165,10000000,2756812.33,3161250.58,4081937.09,04/28/2016 00:00:00,04/28/2016 00:00:00,364,365,AZ,,,Construction,Job Order Contracting (JOC),0,,
Master On-Call General Engineering - Kimley-Horn & Ass.,MA-F165-21000032R2,Approved,Design Professional Master Contract,CNV445118,MA,102 - Design,Denver,F165,1000000,0,0,1000000,08/17/2022 00:00:00,08/17/2022 00:00:00,365,366,CO,,,Professional Service,NA,0,,
Master On-Call 2016: Electrical Engineering GENERAL Design - IMEG (082917),MA-F165-17000160,Closed,Design Professional Master Contract,VS0000010148,MA,102 - Design,Rock Island,F165,1000000,20580,0,979420,11/09/2016 00:00:00,,0,0,IL,,,Professional Service,NA,1000000,,
Arterial Reconstruction Project P3  CP0439P3  Nesbitt Contracting Co Inc,CT-F165-16000027,Closed,Construction Services Contract for Design-Bid-Build Projects,CNV462756,CT,104 - Construction,Tempe,F165,2386732.15,0,0,2386732.15,,,,0,AZ,,Arterial Reconstructions Project 3,Construction,Design Bid Build (DBB),0,,
CP0628GMMI NWWRP Master Meter System Improvements C & M Regulatory Pipeline Consultants,CT-F165-20000073,Approved,Design Professional Services Contract,VS0000012844,CT,102 - Design,Tempe,F165,53417,0,0,53417,,12/11/2019 00:00:00,0,0,AZ,,"NWWRP Gas Master Meter System Improvements, NWWRP Gas Master Meter System Improvements - FUNDING ONLY",Professional Service,NA,0,,
CP0630-0006 SEWRP 3W Line Replacement Garney Job Order,DO-F165-19004399,Approved,Job Order,CNV390275,DO,104 - Construction,Kansas City,F165,385827.14,0,0,385827.14,12/12/2018 00:00:00,12/03/2018 00:00:00,280,281,MO,MA-F165-18000007R1,"SEWRP 3W Line Replacements and Pipeline Modifications, SEWRP Misc Plant Imp 2014 WW Bond - Funding Only",Construction,Job Order Contracting (JOC),385827.14,,
CP0299CSPS Sherwood Park Irrigation Upgrades -2 Valley Rain Construction Job Order,DO-F165-15008834,Approved,Job Order,MAR222550210,DO,104 - Construction,Tempe,F165,736227.81,0,0,736227.81,04/09/2015 00:00:00,04/06/2015 00:00:00,160,161,AZ,MA-F165-14000392R1,Candlelight &amp; Sherwood Park Sprinkler,Construction,Job Order Contracting (JOC),713241.09,,
CP1021WS01 Gas Chlorine System Improvements Jensen Engineering Project Order,DO-F165-21001249,Approved,Project Order,CNV385395,DO,102 - Design,Cave Creek,F165,12375,0,0,12375,08/31/2020 00:00:00,08/31/2020 00:00:00,180,181,AZ,MA-F165-19000132R1,"Gas Chlorine System Improvements, Gas Chlorine System Improvements - FUNDING ONLY",Professional Service,NA,12375,,
CP1105MCP MCP 2nd FLoor Remodel Adaptive Architects Inc Project Order,DO-F165-22007265,Approved,Project Order,CNV380229,DO,102 - Design,Mesa,F165,54567,0,0,54567,03/10/2022 00:00:00,03/10/2022 00:00:00,90,91,AZ,MA-F165-21000157R1,"MCP 2nd Floor Remodel, MCP 2nd Floor Remodel - FUNDING ONLY",Professional Service,NA,0,,
CP0298FRKW Ball Field Lighting Upgrades Package 5,DO-F165-15002042,Approved,Job Order,MAR222550210,DO,104 - Construction,Tempe,F165,229870.21,0,0,229870.21,10/07/2014 00:00:00,,120,0,AZ,MA-F165-14000392R1,Franklin West Elem - 1 Field,Construction,Job Order Contracting (JOC),229870.21,,
CP0043 Eagle Crest Lift Station Improvements   Stantec Consulting Services Inc,DO-F165-16005903,Approved,Project Order,VS0000000998,DO,102 - Design,Chicago,F165,98600,0,0,98600,,02/01/2016 00:00:00,,0,IL,MA-F165-15000141R1,Eagle Crest Lift Station Rehabilitation,Professional Service,,97508.78,,
LF0033ASH Asphalt Patching at Signal Butte and Guadalupe,DO-F165-16009157,Approved,Job Order,CNV570044,DO,120 - Direct Expenses,Tempe,F920,23092.99,0,0,23092.99,05/23/2016 00:00:00,05/12/2016 00:00:00,7,15,AZ,MA-F165-13000770Y4,Asphalt Patching Program,Construction,Job Order Contracting (JOC),23092.99,,
Master On-Call 2018 RENEWAL: Cost Engineering Services - Rider Levett Bucknall,MA-F165-18000136R1,Approved,Design Professional Master Contract,VS0000007610,MA,102 - Design,Phoenix,F165,1000000,16460,0,983540,01/24/2018 00:00:00,,0,0,AZ,,,Professional Service,NA,0,,
2023516Ctes1,2023516Ctes1,Estimate,CMAR Construction Services Contract,ALL STAR SPORTS LLC,MA,,Acworth,F165,0,0,0,0,,,0,0,GA,,2023120Ptest2,Construction,Construction Manager at Risk (CMAR),0,,
Master On-Call RENEWAL: Mechanical Engineering - Spectrum,MA-F165-19000039R1,Approved,Design Professional Master Contract,VS0000003513,MA,102 - Design,Salt Lake City,F165,1000000,0,0,1000000,08/24/2019 00:00:00,08/29/2019 00:00:00,365,366,UT,,,Professional Service,NA,0,,
CP0347CAP MAC Art Place  Boora Architects Inc,CT-F165-15000012,Approved,Consultant Standard Terms Contract,VS0000003069,CT,,Portland,F165,6800,0,0,6800,08/29/2015 00:00:00,,120,0,OR,,ArtPlace America 21 Century Cafe,Professional Service,,0,,
"LF0440R28 Recker Road, 2nd Street & 8th Street Speed Cushions/Talis JOC",DO-F165-21004923,Approved,Job Order,CNV570044,DO,120 - Direct Expenses,Mesa,F165,43970.81,0,0,43970.81,01/27/2021 00:00:00,01/20/2021 00:00:00,75,76,AZ,MA-F165-19003186R1,Speed Cushion Installation R28 - FUNDING ONLY,Construction,Job Order Contracting (JOC),0,,
"JOC-FS20 Job Order Contract Master: Metro Fire Equipment, Inc.",MA-F165-22000025R1,Approved,Job Order Master,CNV616060,MA,104 - Construction,Gilbert,F165,1500000,0,0,1500000,07/29/2022 00:00:00,07/29/2022 00:00:00,365,366,AZ,,,Construction,Job Order Contracting (JOC),0,,
CP0630ISOC SEWRP Odor Evaluation - Brown and Caldwell Project Order,DO-F165-19001646,Closed,Project Order,CNV117684,DO,102 - Design,San Francisco,F165,59978,0,0,59978,09/11/2018 00:00:00,09/11/2018 00:00:00,120,121,CA,MA-F165-17000099R1,"Influent Structure Odor Control, Influent Structure Odor Control-Funding only",Professional Service,NA,58477.73,,
JOC-T15 Renewal1 Job Order Contracting Transportation Services - Talis Construction,MA-F165-16000375R1,Approved,Job Order Master,CNV570044,MA,104 - Construction,Tempe,F165,10000000,7330371.86,1992800.21,676827.93,04/28/2017 00:00:00,04/28/2017 00:00:00,365,366,AZ,,,Construction,Job Order Contracting (JOC),0,,
14000081,MA-F165-14000081,Approved,Design Professional Master Contract,VC0000002120,MA,,Chandler,F165,1000000,0,0,1000000,07/09/2012 00:00:00,06/10/2014 00:00:00,,0,AZ,,,Professional Service,,1000000,,
CP0140CAP Wastewater Manhole Rehab B&F Contracting,DO-F165-14008992,Approved,Job Order,CNV668524,DO,104 - Construction,Phoenix,F165,589484.92,0,0,589484.92,05/21/2014 00:00:00,,250,0,AZ,MA-F165-14000391R1,Wastewater Manhole Rehabilitation,Construction,Job Order Contracting (JOC),536755.89,,
OT0093RAD AZMNH Environmentally Sealed Basement w/ HVAC Improvements CORE/JOC,DO-F165-20006828,Approved,Job Order,VS0000002305,DO,104 - Construction,Phoenix,F165,134373,0,0,134373,07/27/2020 00:00:00,03/03/2020 00:00:00,60,61,AZ,MA-F165-19003214,"AZMNH Radon Mitigation, AZMNH Radon Mitigation-FUNDING ONLY",Construction,Job Order Contracting (JOC),0,,
CP0860P3 Commercial Water Meter Rehabilitation PH 12/The Fishel Construction Company/DBB,CT-F165-21000089,Approved,Construction Services Contract for Design-Bid-Build Projects,CNV120499,CT,104 - Construction,Columbus,F165,1077008.89,0,0,1077008.89,06/14/2021 00:00:00,05/10/2021 00:00:00,203,204,OH,,"Water Meter Vault Rehab Phase 12, Water Meter Vault Rehab Phase 3-Funding only",Construction,Design Bid Build (DBB),0,,
CP0075CAP Regulator Stn Hawes: McKellips Rd to Hermosa Vista,CT-F165-16000058,Approved,Design Professional Services Contract,VS0000003462,CT,102 - Design,Pittsburgh,F165,45090.7,0,0,45090.7,10/20/2015 00:00:00,,92,93,PA,,"High Pressure Gas Line Ext. &amp; Regulator Station Installation Hawes-McKellips to Hermosa Vista - FUNDING ONLY, High Pressure Gas Line Ext. &amp; Regulator Station Installation Hawes-McKellips to Hermosa Vista Master",Professional Service,,0,,
LF0372 Gene Autry Field 2 and 3 Regrading Valley Rain Job Order,DO-F165-20009684,Approved,Job Order,MAR222550210,DO,104 - Construction,Tempe,F165,386616.65,0,0,386616.65,06/26/2020 00:00:00,06/24/2020 00:00:00,80,81,AZ,MA-F165-20000015,"Gene Autry Field 2 &amp; 3 Regrading, Gene Autry Field 2 &amp; 3 Regrading - FUNDING ONLY",Construction,Job Order Contracting (JOC),406887.73,,
Master On-Call RENEWAL: Mechanical Engineering - Pearson,MA-F165-15000160R1,Closed,Design Professional Master Contract,VS0000001699,MA,102 - Design,Phoenix,F165,1000000,0,0,1000000,10/02/2015 00:00:00,,,0,AZ,,,Professional Service,,1000000,,
CP0653 Various Locations – COM Traffic Signal Cabinet Upgrades / Roadway Electric,CT-F165-19000099,Approved,Construction Services Contract for Design-Bid-Build Projects,CNV110434,CT,104 - Construction,Phoenix,F165,1479036.89,0,0,1479036.89,03/18/2019 00:00:00,02/26/2019 00:00:00,210,241,AZ,,"Upgrade Traffic Signal Controllers, Upgrade Traffic Signal Controllers OTR - funding only, Various Locations - City of Mesa Traffic Signal Cabinet Upgrades",Construction,Design Bid Build (DBB),0,,
CP0571DCR Elliot Road Tech Corridor DCR-Kreuzer Consulting Group,CT-F165-16000104,Approved,Design Professional Services Contract,CNV109096,CT,102 - Design,Seal Beach,F165,236383,0,0,236383,04/05/2016 00:00:00,,200,0,CA,,"Elliot Road Improvements, Loop 202 to Signal Butte",Professional Service,,0,,
CP0120CAP Construction Services Contract CMAR GMP 1 Haydon Building Corp.,CT-F165-15000056,Approved,CMAR Construction Services Contract,CNV527408,CT,104 - Construction,Phoenix,F165,23783,0,0,23783,11/20/2014 00:00:00,,52,0,AZ,,McKellips &amp; Ellsworth Park Development,Construction,Construction Manager at Risk (CMAR),0,,
Master On-Call Transportation Services - EPS,MA-F165-21000114,Approved,Design Professional Master Contract,CNV668257,MA,,Mesa,F165,1000000,0,0,1000000,,10/21/2020 00:00:00,0,0,AZ,,,Professional Service,NA,0,,
GWRP Sludge Piping Replacement CP0590-0001 Felix Construction,DO-F165-17006146,Approved,Job Order,CNV159034,DO,104 - Construction,Coolidge,F165,751058.4,0,0,751058.4,,01/05/2017 00:00:00,281,0,AZ,MA-F165-14000500R3,"GWRP Sludge Piping Replacement, GWRP Sludge Piping Replacement Funding Only",Construction,Job Order Contracting (JOC),781150.76,,
C09036WAL2 Screen Walls and Drainage Improvements at WWII Hangar SDB Inc Job Order,DO-F165-22002676,Approved,Job Order,CNV673366,DO,104 - Construction,Tempe,F165,82501.35,0,0,82501.35,11/01/2021 00:00:00,10/25/2021 00:00:00,90,91,AZ,MA-F165-19003215R2,"CONSTRUCT TWO (2) SITE WALL FENCE(S) - FUNDING ONLY, Two (2) New Site Walls and Drainage Improvements at WWII Hangar",Construction,Job Order Contracting (JOC),0,,
CP0474-0004 Sewer Line Repair - Horne/Broadway and Williams/Broadway Job Order B&F Contracting,DO-F165-15009810,Approved,Job Order,CNV668524,DO,104 - Construction,Phoenix,F165,222560.29,0,0,222560.29,06/09/2015 00:00:00,05/13/2015 00:00:00,87,87,AZ,MA-F165-14000391R1,Sewer Line Repair - Horne / Broadway and Williams / Broadway,Construction,Job Order Contracting (JOC),196937.83,,
Master On-Call RENEWAL: Water-Wastewater in ROW - Hoskin Ryan,MA-F165-15000139R1,Closed,Design Professional Master Contract,VS0000005577,MA,102 - Design,Phoenix,F165,1000000,504260,0,495740,10/02/2015 00:00:00,,,0,AZ,,,Professional Service,,1000000,,
CP1051GRT FEMA Exhaust System - Station 202 Spectrum Engineers Project Order,DO-F165-22000487,Approved,Project Order,VS0000003513,DO,102 - Design,Salt Lake City,F165,90400,0,0,90400,08/05/2021 00:00:00,08/05/2021 00:00:00,130,131,UT,MA-F165-21000049,"FEMA Fire Station Exhaust System, FEMA Fire Station Exhaust System - FUNDING ONLY",Professional Service,NA,90400,,
CP0464-0042 8th Avenue Water and Gas Relocation: Dobson to Sycamore Aztec,DO-F165-17008940,Approved,Project Order,VS0000001831,DO,102 - Design,Phoenix,F920,22731.21,0,0,22731.21,,06/01/2017 00:00:00,0,0,AZ,MA-F165-16000351R1,"8th Avenue WaterMain Replacement, 8th Avenue WaterMain Replacement -Funding Only",Professional Service,NA,22731.21,,
"Master On-Call 2018 RENEWAL: Electrical, Instrumentation, and Control Inspection and Testing Services - Quantum",MA-F165-18000200R1,Approved,Design Professional Master Contract,CNV109797,MA,102 - Design,Tempe,F165,250000,0,0,250000,03/29/2019 00:00:00,03/29/2019 00:00:00,0,0,AZ,,,Professional Service,NA,0,,
Master On-Call RENEWAL: Transportation - EPS Group,MA-F165-15000193R1,Closed,Design Professional Master Contract,CNV668257,MA,102 - Design,Mesa,F165,1000000,0,0,1000000,10/16/2015 00:00:00,,,0,AZ,,,Professional Service,,1000000,,
CP0096 PSTF Burn Facility Expansion JE Bowen DBB Contract,CT-F165-16000087,Approved,Construction Services Contract for Design-Bid-Build Projects,CNV55204,CT,104 - Construction,Mesa,F165,91105.56,0,0,91105.56,02/01/2016 00:00:00,01/14/2016 00:00:00,225,0,AZ,,PSTF - Burn Facility Expansion,Construction,Design Bid Build (DBB),0,,
OT0136CAP Asian District Gateway Arch Feasibility Study GH2 Architects Project Order,DO-F165-22007340,Approved,Project Order,VS0000011617,DO,102 - Design,Tulsa,F165,32038,0,0,32038,03/10/2022 00:00:00,03/10/2022 00:00:00,155,156,OK,MA-F165-21000159R1,"Asian District Gateway Arch Feasibility Study, Asian District Gateway Arch Feasibility Study - FUNDING ONLY",Professional Service,NA,0,,
CP0312B202 Baseline and 202 Transportation Project,DO-F165-14004370,Approved,Job Order,CNV570044,DO,,Tempe,F165,9288.15,0,0,9288.15,02/20/2014 00:00:00,06/10/2014 00:00:00,60,0,AZ,,Baseline and 202 Transportation Project,Construction,Job Order Contracting (JOC),9288.15,,
LF0120PUMP Pump Station No. 4 & 5 Rehab,CT-F165-15000124,Approved,Consultant Standard Terms Contract,VS0000004973,CT,120 - Direct Expenses,Kansas City,F165,8400,0,0,8400,03/19/2015 00:00:00,,45,0,MO,,Pump Station 4 and 5 Drainage Improvements,Professional Service,,8400,,
