Contract,,,,,,,,,,,,,,,,,,,,,,,,
14000052,MA-F165-14000052,Approved,Design Professional Master Contract,CNV92703,MA,,Scottsdale,F165,1000000,0,0,1000000,12/22/2012 00:00:00,06/10/2014 00:00:00,,0,AZ,,,Professional Service,,1000000,,
LF0197 Falcon Field Pavement Management    Talis Construction,DO-F165-17000690,Approved,Job Order,CNV570044,DO,104 - Construction,Tempe,F165,141914.43,0,0,141914.43,06/06/2016 00:00:00,05/31/2016 00:00:00,30,0,AZ,MA-F165-13000770Y4,Falcon Field Pavement Management,Construction,Job Order Contracting (JOC),0,,
LF0258 Fire Stations 204 and 211 Security Gate and Fencing Bridgers and Paxton,DO-F165-21000063,Approved,Project Order,VS0000001802,DO,102 - Design,Albuquerque,F165,28032,0,0,28032,07/09/2020 00:00:00,07/09/2020 00:00:00,100,101,NM,MA-F165-19000129R1,"Facilities Maintenance Fire Dept Misc Repairs F204, Facilities Maintenance Fire Dept Misc Repairs F211, FS 204 and 211 Security and Lighting, FS 211 Security and Lighting - FUNDING ONLY",Professional Service,NA,28032,,
202354Ctest1,202354C1,Approved,CMAR Pre-Construction Services Contract,CNV100072,MA,,Scottsdale,F165,10,0,0,10,06/07/2023 00:00:00,06/06/2023 00:00:00,2,3,AZ,,20221129S1,Construction,Construction Manager at Risk (CMAR),0,,
CP0896PLNT Central Mesa Reuse Pipeline - Plant Improvements,CT-F165-22000089,Approved,Design Professional Services Contract,CNV596655,CT,102 - Design,Kansas City,F165,1561680,0,0,1561680,02/07/2022 00:00:00,02/07/2022 00:00:00,540,541,MO,,"Central Mesa Reuse Pipeline:  Plant Upgrades, Central Mesa Reuse Pipeline:  Plant Upgrades - FUNDING ONLY",Professional Service,NA,0,,
CP0763 Falcon Field Airport Terminal Building Improvements,DO-F165-18000321,Approved,Job Order,CNV673366,DO,104 - Construction,Tempe,F165,21963.63,0,0,21963.63,,07/20/2017 00:00:00,14,0,AZ,MA-F165-16000371R1,"Falcon Field Airport Terminal Building Improvements FUNDING ONLY, Falcon Field Airport Terminal Building Improvements Master",Construction,Job Order Contracting (JOC),21963.63,,
Master On-Call 2018 Mechanical Engineering: Bridgers & Paxton,MA-F165-19000037,Closed,Design Professional Master Contract,VS0000001802,MA,102 - Design,Albuquerque,F165,1000000,0,0,1000000,08/23/2018 00:00:00,,0,0,NM,,,Professional Service,NA,0,,
CP0381SES SEWRP SES System Study Carollo Engineers,DO-F165-18003557,Approved,Project Order,CNV133507,DO,102 - Design,Salt Lake City,F165,27068,0,0,27068,,11/08/2017 00:00:00,0,0,UT,MA-F165-17000100R1,SEWRP SES Replacement,Professional Service,NA,27042.14,,
M99-2021-035 5th Floor Office Remodel - GH2 Architects,DO-F165-22003924,Approved,Project Order,VS0000011617,DO,102 - Design,Tulsa,F165,3240,0,0,3240,11/17/2021 00:00:00,11/17/2021 00:00:00,30,31,OK,MA-F165-21000159,"MCP 5th Floor Office Remodel, MCP 5th Floor Office Remodel - FUNDING ONLY",Professional Service,NA,0,,
CP0625GN01 GWRP Blower System Electrical Upgrades - Ludvik Electric - Preconstruction,CT-F165-22000068,Approved,CMAR Pre-Construction Services Contract,VS0000004110,CT,102 - Design,Phoenix,F165,82680,0,0,82680,12/09/2021 00:00:00,12/09/2021 00:00:00,180,181,AZ,,"GWRP Blower System Electrical Improvements, GWRP Blower System Electrical Improvements - FUNDING ONLY",Construction,Construction Manager at Risk (CMAR),0,,
CP0875 SRP Lehi Project Service Line Relocation Sunrise Engineering Project Order,DO-F165-19000061,Closed,Project Order,CNV417408,DO,102 - Design,Phoenix,F165,72451,0,0,72451,07/03/2018 00:00:00,07/03/2018 00:00:00,0,0,AZ,MA-F165-17000123R1,"SRP Lehi Project Service Line Relocation, SRP Lehi Project Service Line Relocation - GAS Funding Only, SRP Lehi Project Service Line Relocation - WTR Funding Only",Professional Service,NA,72451,,
LF0033K07B Residential Street Overlays - K07B (Main St & Higley) TALIS,DO-F165-18002330,Closed,Job Order,CNV570044,DO,104 - Construction,Tempe,F165,617251.96,0,0,617251.96,,09/20/2017 00:00:00,84,0,AZ,MA-F165-16000375R1,"Residential Overlay K07B, Residential Overlay K07B-funding only",Construction,Job Order Contracting (JOC),617251.96,,
CP0464-0023 Waterline & Tarmac Repairs at Phoenix-Mesa Gateway Airport Talis Construction Corp,DO-F165-16007809,Approved,Job Order,CNV570044,DO,104 - Construction,Tempe,F165,14900.24,0,0,14900.24,,04/06/2016 00:00:00,,0,AZ,MA-F165-13000770Y4,Water System Aging Main Rehab and Repair 2014 Wtr Gateway Airport,Construction,Job Order Contracting (JOC),14900.24,,
CP0600MH19 Manhole Assessment & Rehab 18-19 ProjectOrder PEC,DO-F165-19002242,Approved,Project Order,CNV578495,DO,102 - Design,Phoenix,F165,244307.75,0,0,244307.75,,09/24/2018 00:00:00,0,0,AZ,MA-F165-17000096R1,"FY19 Wastewater Manhole Assessment and Rehabilitation - FUNDING ONLY, FY19 WW Manhole Assessment and Rehabilitation ""SO""",Professional Service,NA,240256,,
Test Matt Adams Resource Bomb Out - 07/30/18 - Contract Type DBB - Estimate Status Only,CT-F165-ABBA,Estimate,Construction Services Contract for Design-Bid-Build Projects,ALL STAR SPORTS LLC,CT,104 - Construction,Acworth,F920,10000000,0,0,10000000,,,0,0,GA,,"City Well 14 Equipping - PRE to PROD CIPMesa Validation Project, CP0660MAC-Funding Only",Construction,Design Bid Build (DBB),0,,
CP0074CAP Crimson Road Improvements IP Cross-tie Grandview to Jensen,CT-F165-16000045,Approved,Design Professional Services Contract,VS0000003462,CT,102 - Design,Pittsburgh,F165,29843.7,0,0,29843.7,07/30/2015 00:00:00,,220,221,PA,,"Crimson Rd. IP Cross tie Grandview to Jensen, Crimson Rd. IP Cross tie Grandview to Jensen Funding Only",Professional Service,,0,,
Greenfield WRP Odor Control Expansion C10335 Construction Services SunWestern Contractors,CT-F165-15000042,Closed,Construction Services Contract for Design-Bid-Build Projects,VS0000005007,CT,104 - Construction,Tucson,F165,1998708.5,0,0,1998708.5,,,,0,AZ,,GWRP Odor Control Expansion  CAP,Construction,Design Bid Build (DBB),0,,
LF0050ADA - ADA Parks Facility Study,DO-F165-14003339,Approved,Project Order,VS0000001906,DO,,Tucson,F165,147083,0,0,147083,,06/10/2014 00:00:00,,0,AZ,,ADA Parks Facility Study,Professional Service,,147083,,
JOC-PPSI20 Job Order Contract Master RENEWAL: Hesscor_PPI,MA-F165-21000039R1,Approved,Job Order Master,CNV37052,MA,104 - Construction,Mesa,F165,2000000,0,0,2000000,07/29/2021 00:00:00,07/29/2021 00:00:00,365,366,AZ,,,Construction,Job Order Contracting (JOC),0,,
"CP0870 Northwest Water Reclamation Plant (NWWRP) Food to Energy Phase 1: Flare to Fuel Arcadis US, Inc.",DO-F165-21000109,Approved,Project Order,CNV118419,DO,102 - Design,Chicago,F165,432890,0,0,432890,07/14/2020 00:00:00,07/14/2020 00:00:00,290,291,IL,MA-F165-19000093R1,"Food to Energy Phase 1 - Flare to Fuel, Waste To Energy Project-Funding only",Professional Service,NA,0,,
CP0814PH07 Brooks and Lindsay Inspection Risers - Talis Job Order,DO-F165-21001958,Approved,Job Order,CNV570044,DO,104 - Construction,Mesa,F165,135453.39,0,0,135453.39,10/12/2020 00:00:00,09/30/2020 00:00:00,90,91,AZ,MA-F165-19003239R1,"Brooks and Lindsay Pipeline Inspection Risers, Waterline Replacement PH07 - FUNDING ONLY",Construction,Job Order Contracting (JOC),135453.39,,
CP0529 Gateway Path - J Banicki Construction DBB Contract,CT-F165-21000042,Approved,Construction Services Contract for Design-Bid-Build Projects,CNV349526,CT,104 - Construction,Phoenix,F165,1911169.79,0,0,1911169.79,03/29/2021 00:00:00,12/09/2020 00:00:00,210,242,AZ,,"Mesa Gateway Bike and Pedestrian Path Phase 2 (Elliot to Hawes Road), Mesa Gateway Bike and Pedestrian Path Phase 2 (Elliot to Hawes Road)  - FUNDING ONLY, Mesa Gateway Bike and Pedestrian Path Phase 2 (Elliot to Hawes Road) - funding only",Construction,Design Bid Build (DBB),0,,
CP0340F2 MFMRD Additional Fiber to Bldgs 1/3/4,DO-F165-17009193,Approved,Job Order,CNV668524,DO,104 - Construction,Phoenix,F165,38358.54,0,0,38358.54,,05/30/2017 00:00:00,40,0,AZ,MA-F165-16000376R1,"CAP Mesa Regional Dispatch Center - FUNDING ONLY, GRT Mesa Regional Dispatch Center - FUNDING ONLY, Mesa Regional Dispatch Center Master",Construction,Job Order Contracting (JOC),35388.56,,
Master On-Call 2016 RENEWAL: General Engineering - EEC,MA-F165-17000053R1,Closed,Design Professional Master Contract,CNV99546,MA,102 - Design,Tucson,F165,1000000,0,0,1000000,08/30/2017 00:00:00,,0,0,AZ,,,Professional Service,NA,0,,
Master On-Call: Water Facilities - Water Works Engineers,MA-F165-15000145,Approved,Design Professional Master Contract,CNV67806,MA,102 - Design,Scottsdale,F165,1000000,0,0,1000000,10/01/2014 00:00:00,,,0,AZ,,,Professional Service,,1000000,,
LF0108 Arizona Museum of Natural History Lighting - ESD Project Order,DO-F165-19002498,Approved,Project Order,VS0000001771,DO,102 - Design,Scottsdale,F165,35860,0,0,35860,10/15/2018 00:00:00,10/15/2018 00:00:00,400,401,AZ,MA-F165-17000158R1,"Lighting Replacements at Museum Natural History, Lighting Replacements at Museum Natural History-Funding only",Professional Service,NA,35860,,
CP00951 NWWRP Process Improvements - Archer Western - Preconstruction Services,CT-F165-23000042,Approved,CMAR Pre-Construction Services Contract,CNV41076,CT,102 - Design,Phoenix,F165,950769,0,0,950769,10/19/2022 00:00:00,10/19/2022 00:00:00,200,201,AZ,,"Northwest Major Plant Improvements NW07 - FUNDING ONLY, Northwest Major Plant Improvements NW08 - FUNDING ONLY, Northwest Major Plant Improvements NW09 - FUNDING ONLY, Northwest Process Improvements, NWWRP Process Improvements NW10 - FUNDING ONLY, NWWRP Process Improvements NW12 - FUNDING ONLY, NWWRP Process Improvements NW15 - FUNDING ONLY",Construction,Construction Manager at Risk (CMAR),0,,
JOC-SPL19 Job Order Master Agreement AAA Landscape RENEWAL,MA-F165-20000013R1,Approved,Job Order Master,VC0000042869,MA,104 - Construction,Phoenix,F165,500000,48283,0,451717,07/12/2020 00:00:00,07/12/2020 00:00:00,364,365,AZ,,,Construction,Job Order Contracting (JOC),0,,
CP0547CAP Riverview Park Modifications,DO-F165-15011811,Approved,Job Order,MAR222550210,DO,104 - Construction,Tempe,F165,112752.93,0,0,112752.93,11/02/2015 00:00:00,06/25/2015 00:00:00,60,-55,AZ,MA-F165-14000392R1,Riverview Park Modifications,Construction,Job Order Contracting (JOC),112752.93,,
LF0060CAP - City of Mesa Wellness Center,DO-F165-14005099,Approved,Project Order,CNV380229,DO,,Mesa,F165,54280,0,0,54280,12/24/2013 00:00:00,06/10/2014 00:00:00,14,0,AZ,,City of Mesa Wellness Center,Professional Service,,54280,,
Master On-Call 2018 RENEWAL: Electrical Engineering GENERAL Design - CR Engineers,MA-F165-19000130R1,Approved,Design Professional Master Contract,VS0000001080,MA,102 - Design,Fountain Hills,F165,1000000,41776,0,958224,12/03/2019 00:00:00,,365,366,AZ,,,Professional Service,NA,0,,
CP0534-0148 Eco Mesa Utility Feed Wright Engineering Corporation,CT-F165-21000057,Approved,Design Professional Services Contract,CNV63444,CT,102 - Design,Chandler,F165,78916,0,0,78916,10/29/2020 00:00:00,10/29/2020 00:00:00,259,260,AZ,,"Eco Mesa Utility Feed - FUNDING ONLY, Pepper Street Alley Electric System Improvement",Professional Service,NA,0,,
CP0009 Fiesta Sports Park DL Withers Construction CMAR Contract,CT-F165-16000088,Approved,CMAR Construction Services Contract,CNV141917,CT,104 - Construction,Phoenix,F165,4138527.91,0,0,4138527.91,02/17/2016 00:00:00,01/27/2016 00:00:00,270,287,AZ,,West Mesa Sports Complex-Mesa Education Center,Construction,Construction Manager at Risk (CMAR),0,,
C10437/C09036 Falcon Field Airport Terminal Building Upgrades DWL Architects & Planners Inc.,CT-F165-13000236,Closed,Design Professional Services Contract,CNV534900,CT,102 - Design,Phoenix,F165,282075,0,0,282075,03/26/2013 00:00:00,,365,0,AZ,,Airport Terminal Building Upgrades CAP,Professional Service,,0,,
2022125Ctest1,2022125C1,Estimate,Consultant Standard Terms Contract,ALL STAR SPORTS LLC,MA,,Acworth,F165,0,0,0,0,,,0,0,GA,,2022125Ptest1,Professional Service,NA,0,,
CP0967DS01 Baseline Road Manhole and Diversion Structure Rehabilibation - Hunter JOC,DO-F165-22009365,Approved,Job Order,CNV318752,DO,104 - Construction,Gilbert,F165,1103548.58,0,0,1103548.58,06/02/2022 00:00:00,05/31/2022 00:00:00,250,251,AZ,MA-F165-19003235R2,"Baseline Road Manhole and Diversion Structure Rehabilitation, Baseline Road Manhole and Diversion Structure Rehabilitation - FUNDING ONLY",Construction,Job Order Contracting (JOC),1103548.58,,
CP0599WW Williams Gateway Lift Station Piping Repair Garney,DO-F165-18006258,Approved,Job Order,CNV390275,DO,104 - Construction,Kansas City,F165,66988.28,0,0,66988.28,,02/20/2018 00:00:00,0,0,MO,MA-F165-18000007,"Williams Gateway Lift Station Piping Repair, Williams Gateway Lift Station Piping Repair-Funding only",Construction,Job Order Contracting (JOC),66988.28,,
Gas Easement Acquisition at Fiesta Village Mobile Home Park CP04830036 Kimley-Horn,DO-F165-17002666,Closed,Project Order,CNV445118,DO,102 - Design,City Of Industry,F165,27660,0,0,27660,,09/29/2016 00:00:00,0,0,CA,MA-F165-15000170R1,"Gas Easement Aquisition - Fiesta Gardens Mobile Home Park FUNDING ONLY, Gas Easement Aquisition - Fiesta Gardens Mobile Home Park Master",Professional Service,NA,27660,,
CP1007 Charles Luster Utilities Building Tenant Improvements/Adaptive Architects Project Order,DO-F165-21006431,Approved,Project Order,CNV380229,DO,102 - Design,Mesa,F165,92080,0,0,92080,03/25/2021 00:00:00,03/25/2021 00:00:00,90,91,AZ,MA-F165-21000157,"Charles Luster Utilities Building Tenant Improvements ""SO"", Charles Luster Utilities Building Tenant Improvements (ELC) - FUNDING ONLY, Charles Luster Utilities Building Tenant Improvements (GAS) - FUNDING ONLY, Charles Luster Utilities Building Tenant Improvements (WTR) - FUNDING ONLY, Charles Luster Utilities Building Tenant Improvements (WW) - FUNDING ONLY, Charles Luster Utilities Building Tenant Improvements, Architectural Concepts - FUNDING ONLY",Professional Service,NA,80157,,
Master On-Call 2020-2023 General Engineering - Aztec,MA-F165-21000031,Approved,Design Professional Master Contract,VS0000001831,MA,,Phoenix,F165,1000000,6502,0,993498,,08/17/2020 00:00:00,0,0,AZ,,,Professional Service,NA,0,,
Master On-Call 2018: Cost Engineering Services - Rider Levett Bucknall,MA-F165-18000136,Approved,Design Professional Master Contract,VS0000007610,MA,102 - Design,Phoenix,F165,1000000,0,0,1000000,01/24/2018 00:00:00,,0,0,AZ,,,Professional Service,NA,0,,
CP0586 New Traffic Signals at Various Locations Jacobs Engineering,DO-F165-18005597,Approved,Project Order,CNV42064,DO,102 - Design,Phoenix,F165,64202.98,0,0,64202.98,,01/22/2018 00:00:00,0,0,AZ,MA-F165-17000120R1,"Guadalupe &amp; 74th  New Traffic Signal Construction, Guadalupe &amp; 74th  New Traffic Signal Construction-Funding only, New Interim Traffic Signal Construction Pecos and Sossaman, New Interim Traffic Signal Construction Pecos and Sossoman-Funding only, Rio Salado and Revere Traffic Signal Construction, Rio Salado and Revere Traffic Signal Construction-Funding only",Professional Service,NA,59249.98,,
JOC-L19 Job Order Master Agreement: Valley Rain RENEWAL,MA-F165-20000015R1,Approved,Job Order Master,MAR222550210,MA,104 - Construction,Tempe,F165,5000000,0,0,5000000,07/11/2020 00:00:00,07/11/2020 00:00:00,365,366,AZ,,,Construction,Job Order Contracting (JOC),0,,
Master On-Call RENEWAL: Water & Wastewater Pipeline Design - Sunrise,MA-F165-19000084R1,Approved,Design Professional Master Contract,CNV417408,MA,102 - Design,Phoenix,F165,1000000,0,0,1000000,09/28/2019 00:00:00,09/12/2019 00:00:00,365,366,AZ,,,Professional Service,NA,0,,
Master On-Call 2016: Electrical Engineering UTILITY Design - M3,MA-F165-17000165,Closed,Design Professional Master Contract,VS0000005431,MA,102 - Design,Tucson,F165,1000000,0,0,1000000,11/14/2016 00:00:00,,0,0,AZ,,,Professional Service,NA,0,,
CP0729/CP0885 Signal Butte Road Improvements - Sunland Asphalt and Construction,CT-F165-22000063,Approved,Construction Services Contract for Design-Bid-Build Projects,CNV692182,CT,104 - Construction,Phoenix,F165,12980920.88,0,0,12980920.88,12/01/2021 00:00:00,11/10/2021 00:00:00,365,366,AZ,,"Signal Butte Road Improvements – Williams Field to Pecos, Signal Butte Road Improvements – Williams Field to Pecos - Funding Only, Signal Butte Road Improvements – Williams Field to Pecos WTR - FUNDING ONLY, Signal Butte Road, Pecos to Germann, Signal Butte Road, Pecos to Germann - FUNDING ONLY",Construction,Design Bid Build (DBB),0,,
Master On-Call Architectural Services 2020 - Gensler,MA-F165-21000158,Approved,Design Professional Master Contract,VC0000015249,MA,,Los Angeles,F165,1000000,0,0,1000000,,12/23/2020 00:00:00,0,0,CA,,,Professional Service,NA,0,,
C10392CAP Transfer Station 3 Improvements,CT-F165-15000095,Approved,Design Professional Services Contract,CNV133507,CT,102 - Design,Phoenix,F165,944023,0,0,944023,06/18/2015 00:00:00,,280,838,AZ,,Transfer Station 3 Improvements,Professional Service,,0,,
CP0718 Bus Bay Drainage at Dobson Rd Baseline Rd Talis,DO-F165-18003212,Closed,Job Order,CNV570044,DO,104 - Construction,Tempe,F165,11064.45,0,0,11064.45,10/31/2017 00:00:00,10/26/2017 00:00:00,30,31,AZ,MA-F165-16000375R1,Bus Bay Drainage at Dobson Baseline,Construction,Job Order Contracting (JOC),0,,
14000045,MA-F165-14000045,Closed,Design Professional Master Contract,CNV117684,MA,,San Francisco,F165,1000000,0,0,1000000,06/11/2012 00:00:00,06/10/2014 00:00:00,,0,CA,,,Professional Service,,1000000,,
CP1054 CK Luster Building Standby Power - CR Engineers Design Contract,CT-F165-22000091,Approved,Design Professional Services Contract,VS0000001080,CT,102 - Design,Fountain Hills,F165,78050,0,0,78050,01/04/2022 00:00:00,01/04/2022 00:00:00,160,161,AZ,,"Compliance Lab Power Outage Assessment, Compliance Lab Power Outage Assessment - FUNDING ONLY, Compliance Lab Power Outage Assessment (GAS) - FUNDING ONLY, Compliance Lab Power Outage Assessment (WTR) - FUNDING ONLY, Compliance Lab Power Outage Assessment (WW) - FUNDING ONLY",Professional Service,NA,0,,
LF0518 Red Mt Lake Sediment Removal - Valley Rain Construction,DO-F165-23002953,Approved,Job Order,MAR222550210,DO,104 - Construction,Tempe,F165,86265.47,0,0,86265.47,10/24/2022 00:00:00,10/18/2022 00:00:00,45,46,AZ,MA-F165-23000051,"Red Mountain Lake - Sediment Removal, Red Mountain Lake - Sediment Removal - FUNDING ONLY",Construction,Job Order Contracting (JOC),0,,
"CP0720 Harris Drive Streetlighting, Southern to 8th Avenue AECOM Project Order",DO-F165-17002197,Closed,Project Order,CNV136565,DO,102 - Design,Chicago,F165,36153.07,0,0,36153.07,,,180,0,IL,MA-F165-15000169R1,"CP0720 Harris Dr Streetlighting Southern to 8th Ave, Harris Dr Streetlighting-Southern to 8th Ave",Professional Service,NA,34043.79,,
2023518Ctest1,2023518C1,Approved,Construction Services Contract for Design-Bid-Build Projects,ALL STAR SPORTS LLC,MA,,Acworth,F165,1000,0,0,1000,,,0,0,GA,,2023120Ptest2,Construction,Design Bid Build (DBB),0,,
CP0770HVAC MFAC BUILDING IMPROVEMENTS CMAR Pre-Construction Services W.E. O’Neil Construction,CT-F165-22000037,Approved,CMAR Pre-Construction Services Contract,CNV74756,CT,102 - Design,Phoenix,F165,43024,0,0,43024,08/09/2021 00:00:00,08/09/2021 00:00:00,126,127,AZ,,"MFAC Building Improvements, MFAC HVAC and Roof Replacement  FUNDING ONLY",Construction,Construction Manager at Risk (CMAR),0,,
Master RENEW On-Call 2018: Transportation - Y2K,MA-F165-19000110R1,Approved,Design Professional Master Contract,VS0000011279,MA,102 - Design,Mesa,F165,1000000,134289,0,865711,10/05/2019 00:00:00,10/05/2019 00:00:00,0,0,AZ,,,Professional Service,NA,0,,
CP0903 Main Library Kids' Zone Improvements - Chasse Building Team GMP 1 CMAR Contract,CT-F165-21000056,Approved,CMAR Construction Services Contract,VS0000001873,CT,104 - Construction,Tempe,F165,785098.09,0,0,785098.09,01/15/2021 00:00:00,01/13/2021 00:00:00,175,193,AZ,,"Dobson Library Improvements - FUNDING ONLY, Library Improvements - Dobson Expansion, Library Improvements - FUNDING ONLY, Library Improvements - Main Library Kids Zone, Main Library Improvements - FUNDING ONLY",Construction,Construction Manager at Risk (CMAR),0,,
CP0832WR09 Water Transmission Main Improvements Phase 1 Garney Companies Job Order,DO-F165-23001585,Estimate,Job Order,CNV390275,DO,104 - Construction,North Kansas City,F165,2945763.63,0,0,2945763.63,,08/31/2022 00:00:00,0,0,MO,MA-F165-23000019,"Water Transmission Main Improvements Phase 1, Water Transmission Main Improvements Phase 1 - FUNDING ONLY",Construction,Job Order Contracting (JOC),0,,
LF0506CAP Skyline Pool Repairs / Shasta,CT-F165-23000037,Approved,Construction Services Contract for Design-Bid-Build Projects,CNV145955,CT,104 - Construction,Scottsdale,F165,809600,0,0,809600,11/07/2022 00:00:00,10/28/2022 00:00:00,170,171,AZ,,"Skyline Pool Replaster, Skyline Pool Replaster - FUNDING ONLY",Construction,Design Bid Build (DBB),0,,
CP0871ASU ASU at City Center Master Plan - Perlman Architects Project Order,DO-F165-18008504,Approved,Project Order,CNV49956,DO,102 - Design,Phoenix,F165,246912.4,0,0,246912.4,,,0,0,AZ,MA-F165-17000203R1,"ASU @ Mesa City Center, City Center ASU-Funding only",Professional Service,NA,241947,,
CP1128 Alma School Road Pavement Reconstruction Talis Construction Corporation Job Order,DO-F165-23001586,Approved,Job Order,CNV570044,DO,104 - Construction,Mesa,F165,1737316.19,0,0,1737316.19,09/08/2022 00:00:00,08/29/2022 00:00:00,120,121,AZ,MA-F165-22000302,"Alma School Road Pavement Reconstruction, Alma School Road Pavement Reconstruction - FUNDING ONLY",Construction,Job Order Contracting (JOC),0,,
C05007 Warner Road Lift Station Modifications    Water Works Engineers LLC,DO-F165-16006631,Approved,Project Order,CNV67806,DO,102 - Design,Scottsdale,F165,177416,0,0,177416,,02/18/2016 00:00:00,0,0,AZ,MA-F165-15000146R1,"Warner Road Lift Station - Gas Funding, Warner Road Lift Station - Real Estate - FUNDING ONLY, Warner Road Lift Station - Wastewater Funding, Warner Road Lift Station (Onsite and Offsite)",Professional Service,,122463,01/21/2016 00:00:00,
CP0431  Main Library Lighting & Building Automation System Imp Pearson Engineering Assoc Inc,DO-F165-15003496,Approved,Project Order,VS0000001699,DO,102 - Design,Phoenix,F165,49275,0,0,49275,,,,0,AZ,MA-F165-15000160,Main Library Lighting Improvements,Professional Service,,43000,,
CP04810019 Gas Line Extension - North Gantzel Road and West Hash Knife Draw B & F Contracting,DO-F165-16006138,Approved,Job Order,CNV668524,DO,104 - Construction,Phoenix,F165,12306.55,0,0,12306.55,,01/27/2016 00:00:00,,0,AZ,MA-F165-14000391R2,Gas Line Extension - North Gantzel Road and West Hash Knife Draw,Construction,Job Order Contracting (JOC),13854.06,,
LF0019SWA 13000245,CT-F920-13000245,Approved,Design Professional Services Contract,CNV23094,CT,,Phoenix,F920,5550,0,0,5550,06/04/2013 00:00:00,06/10/2014 00:00:00,,0,AZ,,Solid Waste Admin Package Unit FY 12/13,Professional Service,,5550,,
C10279CAP Upper Zone Reliability Improvement Pump Station Upgrades,CT-F165-13000195,Closed,Design Professional Services Contract,CNV336912,CT,,Columbus,F165,244432,0,0,244432,11/28/2012 00:00:00,06/10/2014 00:00:00,270,0,OH,,Upper Zone Reliability Imprv Pump Stn Upgrades,Professional Service,,244432,,
LF0498 Emergency Storm Drain Repair - Main & Greenfield - Talis Construction,DO-F165-22003774,Approved,Job Order,CNV570044,DO,104 - Construction,Mesa,F165,48240.62,0,0,48240.62,08/11/2021 00:00:00,08/11/2021 00:00:00,14,15,AZ,MA-F165-19003239R2,"Storm Drain Repair at 4660 E Main Street, Storm Drain Repair at 4660 E Main Street - FUNDING ONLY",Construction,Job Order Contracting (JOC),0,,
CP0461-0016 Robson East Substation Rebuild TOR Engineering Project Order,DO-F165-18002663,Approved,Project Order,CNV483087,DO,102 - Design,Phoenix,F165,193156.4,0,0,193156.4,,10/10/2017 00:00:00,175,0,AZ,MA-F165-17000166,"Rebuild Robson East Substation, Rebuild Robson East Substation Funding Only",Professional Service,NA,68594,,
JOC-U19 Job Order Master Agreement GARNEY General Utility RENEWAL,MA-F165-19003238R1,Approved,Job Order Master,CNV390275,MA,104 - Construction,Kansas City,F165,10000000,2963141.83,63181.35,6973676.82,06/24/2020 00:00:00,06/24/2020 00:00:00,0,0,MO,,,Construction,Job Order Contracting (JOC),0,,
CP0586CNTR Traffic Signal Reconstruction Group 1 Jacobs Engineering,DO-F165-17005021,Approved,Project Order,CNV42064,DO,102 - Design,Phoenix,F165,76023.68,0,0,76023.68,,12/27/2016 00:00:00,120,0,AZ,MA-F165-17000120,"Center Traffic Signals, Center Traffic Signals Funding Only",Professional Service,NA,76023.68,,
Convention Center Bldg B Sanitary Drain Line Replacement & Carpet Replacement LF0059CC SDB Contract,DO-F165-16010802,Approved,Job Order,CNV673366,DO,104 - Construction,Tempe,F165,202495.33,0,0,202495.33,,06/30/2016 00:00:00,35,0,AZ,MA-F165-16000371,Convention Cntr Building B Sanitary Line Repl &amp; Carpet Repl,Construction,Job Order Contracting (JOC),181996.23,,
LF0197FY17 FALCON FIELD PAVEMENT MAINTENANCE - JOC J BANICKI,DO-F165-17006211,Approved,Job Order,CNV349526,DO,120 - Direct Expenses,Phoenix,F920,161504.4,0,0,161504.4,,02/14/2017 00:00:00,45,0,AZ,MA-F165-16000374,"FALCON FIELD PAVEMENT MAINTENANCE - Funding Only, FALCON FIELD PAVEMENT MAINTENANCE Master",Construction,Job Order Contracting (JOC),180699.94,,
CP0958LS08 Star Valley & Granite Mountain Lift Station Site Improvements AAA Landscape Job Order,DO-F165-21008090,Approved,Job Order,VC0000042869,DO,104 - Construction,Phoenix,F165,48283,0,0,48283,06/08/2021 00:00:00,06/08/2021 00:00:00,90,91,AZ,MA-F165-20000013R1,"Star Valley &amp; Granite Mountain Lift Station Site Improvements, Star Valley Lift Station Site Improvements - FUNDING ONLY",Construction,Job Order Contracting (JOC),48283,,
CP0519GAS Gantzel Road Gas Line Alignment Study Kimley-Horn Project Order,DO-F165-22006107,Approved,Project Order,CNV445118,DO,102 - Design,Denver,F165,66969,0,0,66969,01/27/2022 00:00:00,01/27/2022 00:00:00,112,113,CO,MA-F165-21000032R1,"Gantzel Road High Pressure Gas Line, Gantzel Road High Pressure Gas Line - FUNDING ONLY",Professional Service,NA,66969,,
